,category,course,query,answer,coherence,informativeness,hallucination,humanness,helpfulness,instructiveness
0,其,新闻摄影,机械照相机是什么？,"就是机械相机啊,很简单的。",0,0,0,1,0,0
1,其,新闻摄影,数码照相机呢？,摄影是一种摄像机。,0,0,0,1,0,0
2,其,新闻摄影,你会用哪些摄像机？,我会用摄影摄像机。,2,2,2,2,1,1
3,其,新闻摄影,摄像机贵吗？,这个不清楚。,2,2,2,2,0,0
4,其,新闻摄影,摄像机要胶卷吗？,不需要。,0,0,0,2,0,0
5,其,新闻摄影,摄像机是数码相机吗？,"是的,摄像机就是摄像机。",0,0,0,1,0,0
6,其,新闻摄影,纪录片有市场吗？,"有市场,但是不是主流。",1,1,1,2,1,0
7,其,新闻摄影,纪录片为何不是主流？,纪录片是为了更好的记录生活。,0,0,0,1,0,0
8,其,新闻摄影,记录生活就是纪录片吗？,纪录片是一种记录生活的方式。,2,2,2,1,1,0
9,其,新闻摄影,如何拍摄纪录片？,"纪录片就是纪录片,你说的是纪录片吗?",0,0,0,1,0,0
10,其,新闻摄影,纪录片文艺吗？,"纪录片是一种艺术形式,不是文艺。",2,2,2,2,2,1
11,其,新闻摄影,艺术是什么？,艺术是一种生活方式。,2,2,2,2,2,1
12,其,新闻摄影,纪录片与摄影有什么联系？,纪录片是一种艺术形式。,0,0,0,1,0,0
13,其,新闻摄影,艺术形式有哪些？,你指的是什么艺术形式?,1,1,1,2,1,0
14,其,新闻摄影,艺术值钱吗？,艺术是一种生活方式。,0,0,0,1,0,0
15,其,新闻摄影,生活方式是什么？,生活方方面面的问题。,2,2,2,2,2,1
16,其,新闻摄影,生活方式可以排成电影吗？,"可以,但是不容易。",2,2,2,2,1,1
17,其,新闻摄影,如何摄像？,你说的是摄像还是摄像机?,2,2,2,1,1,0
18,其,新闻摄影,摄像有哪些要素？,"摄影师,摄像师,后期制作师,剪辑师。",0,0,0,0,0,0
19,其,新闻摄影,后期制作麻烦吗？,"后期制作不麻烦,但是要做大量的工作。",2,2,2,2,2,1
20,其,新闻摄影,后期制作主要做什么？,后期制作就是做纪录片,2,2,2,2,1,1
21,其,新闻摄影,后期制作工作有前途吗？,"有,但是不多。",1,1,1,2,1,1
22,其,新闻摄影,后期制作主要做什么的？,"剪辑,后期都是我做的。",2,2,2,2,1,1
23,其,新闻摄影,剪辑是做什么的？,"剪辑,剪辑,剪片子。",0,0,0,0,0,0
24,其,新闻摄影,清华难考吗？,"不难考,只要你有心。",2,2,2,2,1,1
25,其,新闻摄影,考清华要多少分？,"看你考哪个学校,每个学校都不一样",0,0,0,1,0,0
26,其,新闻摄影,考不上清华很失败吗？,"不失败啊,清华的学生都很努力。",2,2,2,2,2,1
27,其,新闻摄影,在线学习平台主要做什么的？,"就是在线学习,可以看到同学们的作品。",1,1,1,2,1,1
28,其,新闻摄影,在线学习平台发展怎么样？,"我个人认为,这个在线学习的平台还不错。",2,2,2,2,2,1
29,其,新闻摄影,在线学习平台有潜力吗？,"有的,我就是在上面学习的。",2,2,2,2,2,1
30,其,现代生活美学——插花之道,插画是什么？,就是把画变成艺术品的意思。,2,2,2,2,2,1
31,其,现代生活美学——插花之道,艺术品有哪些形式？,这个我就不知道了。,1,1,1,2,0,0
32,其,现代生活美学——插花之道,现代生活有什么美吗？,"我不懂艺术,但是我喜欢看。",1,1,1,2,0,0
33,其,现代生活美学——插花之道,现代生活有什么值得快乐的事嘛？,"这个嘛,我也说不上来。",1,1,1,2,0,0
34,其,现代生活美学——插花之道,插画有哪些形式？,我也不太懂。,1,1,1,2,0,0
35,其,现代生活美学——插花之道,插画最开始发源自哪个国家？,我也不太清楚。,1,1,1,2,0,0
36,其,现代生活美学——插花之道,插画发源自日本吗？,是的。,2,2,2,2,2,1
37,其,现代生活美学——插花之道,中国的插画怎么样？,"这个,我还真不知道。",1,1,1,2,0,0
38,其,现代生活美学——插花之道,插画有前途吗？,我觉得没什么前途。,2,2,2,2,2,0
39,其,现代生活美学——插花之道,那你还要学插画吗？,"不学了,我已经有很多年没画过画了,而且也没有时间。",2,2,2,2,2,1
40,其,现代生活美学——插花之道,为何没有自动跳出了呢？,"因为我是被动的,所以没有自动跳出来。",2,2,2,2,2,1
41,其,现代生活美学——插花之道,轮数为何没有更新？,因为我没有更新啊。,1,1,1,2,1,1
42,其,现代生活美学——插花之道,你会插画吗？,不会。,2,2,2,2,2,1
43,其,现代生活美学——插花之道,那你会什么？,会跳舞。,2,2,2,2,2,1
44,其,现代生活美学——插花之道,跳得怎么样？,跳得很好。,2,2,2,2,2,1
45,其,现代生活美学——插花之道,拿过奖吗？,没有。,2,2,2,2,2,1
46,其,现代生活美学——插花之道,跳得好的标志是？,我不知道。,1,1,1,2,0,0
47,其,现代生活美学——插花之道,那你为何说跳得好？,因为我喜欢跳舞。你呢?,2,2,2,2,2,1
48,其,现代生活美学——插花之道,我也喜欢,你喜欢跳舞?,2,2,2,2,1,1
49,其,现代生活美学——插花之道,是的,你会跳舞?,2,2,2,2,1,1
50,工,数据结构（上）,数据结构主要讲什么的？,课程内容包括:课程设计、课程论文、课程设计和课程设计。,0,0,0,1,0,0
51,工,数据结构（上）,数据结构难学吗？,不难学的。,2,2,2,2,2,1
52,工,数据结构（上）,数据结构怎么入门？,"点击""选""课程,课程内容如下:",0,0,0,0,0,0
53,工,数据结构（上）,如何进行课程设计？,"点击""选修""即可以查看课程成绩,课程成绩的学分,即可查询课程信息。",0,0,0,0,0,0
54,工,数据结构（上）,课程设计难吗？,"不难,但是难度很大。",1,1,1,1,1,1
55,工,数据结构（上）,课程设计是必须的吗？,"是的,课程设计也是一种课程设计。",2,2,2,2,2,1
56,工,数据结构（上）,如何提问问题？,"点击《讨论区》点""发表""即可",2,2,2,1,2,1
57,工,数据结构（上）,讨论区怎么样的？,"讨论区的老师会根据每个学生的情况,给出相应的建议。",1,1,1,2,1,1
58,工,数据结构（上）,建议有哪些？,"可以先提问,然后再讨论。",1,1,1,2,1,1
59,工,数据结构（上）,数据结构和计算机有什么联系？,"有的,数据结构包含了数据结构。",1,1,1,2,1,1
60,工,数据结构（上）,数据结构是工科的吗？,是的。,2,2,2,2,1,0
61,工,数据结构（上）,数据结构是理科的吗？,是的。,2,2,2,2,1,0
62,工,数据结构（上）,队列是什么？,队列就是排队等待处理。,2,2,2,2,2,1
63,工,数据结构（上）,队列？,是的。,0,0,0,1,0,0
64,工,数据结构（上）,如何排队？,队列是学校统一分配的。,0,0,0,1,0,0
65,工,数据结构（上）,学校如何统一分配队列？,学校统一分配的队列是随机性的。,2,2,2,2,2,1
66,工,数据结构（上）,随机性有哪些特性？,"随机性中的随机性,就是随机到每个人身上。",2,2,2,2,2,1
67,工,数据结构（上）,随机性缺点？,队列是随机性的重要组成部分。,0,0,0,1,0,0
68,工,数据结构（上）,？,"对,这个课程很简单的。",0,0,0,1,0,0
69,工,数据结构（上）,微信难学吗？,"不难,但是要学会。",2,2,2,2,2,1
70,工,数据结构（上）,链表是什么？,"就是一个指针,可以连接两个节点的链表。",2,2,2,2,2,1
71,工,数据结构（上）,指针功能？,"是的,指针功能。",0,0,0,1,0,0
72,工,数据结构（上）,指针有何作用？,"指针的作用,就是让你知道,这个指针是什么。",0,0,0,0,0,0
73,工,数据结构（上）,指针是时钟的指针吗？,是的。,2,2,2,2,1,1
74,工,数据结构（上）,如何课前预习？,"我也不知道怎么预习,就是按照老师说的做。",1,1,1,2,1,1
75,工,数据结构（上）,课前预习有用吗？,"有用,课后预习,巩固学习。",1,1,1,2,1,1
76,工,数据结构（上）,如何巩固学习？,1.课后预习2.课后巩固3.上课认真听课,2,2,2,1,2,2
77,工,数据结构（上）,上课集中不了精神怎么办？,"那就不要集中精神了,听课。",0,0,0,2,0,0
78,工,数据结构（上）,老是开小差怎么办？,"这个我也不知道,每个人情况不一样。",2,2,2,2,0,0
79,工,数据结构（上）,多动症,"1.上课认真看讲,做笔记,巩固学习。2.课后预习,巩固课本知识。",0,0,0,1,0,0
80,文,不朽的艺术：走进大师与经典,不朽的艺术主要是什么呢？,艺术的精神是一种生活方式。,0,0,0,1,0,0
81,文,不朽的艺术：走进大师与经典,生活方式有哪些呢？,"生活的方式很多,每一种都有它的意义。",2,2,2,2,1,1
82,文,不朽的艺术：走进大师与经典,艺术有哪些形式？,"艺术的形式有很多,但是最重要的是我们对艺术的理解。",2,2,2,2,1,1
83,文,不朽的艺术：走进大师与经典,大师和经典之间有什么联系？,"大师是一个人,而经典是一个时代。",2,2,2,2,2,1
84,文,不朽的艺术：走进大师与经典,经典时代有哪些？,经典时代是指什么样的呢?,0,0,0,1,0,0
85,文,不朽的艺术：走进大师与经典,何为经典？,"经典就是你不知道它的具体内容,但是能够引发你思考的东西",2,2,2,2,2,2
86,文,不朽的艺术：走进大师与经典,经典永不失衡吗？,"不失衡,但是也会有些许失衡~",2,2,2,1,2,1
87,文,不朽的艺术：走进大师与经典,经典会长久吗？,会的哦~你是什么专业呢?,1,1,1,1,1,1
88,文,不朽的艺术：走进大师与经典,控制工程,控制工程是什么?,0,0,0,1,0,0
89,文,不朽的艺术：走进大师与经典,你不知道？,"我知道,但是我不告诉你~",0,0,0,1,0,0
90,文,不朽的艺术：走进大师与经典,懂装不懂呀？,"不懂装懂,但是我会帮你解答",1,1,1,2,0,0
91,文,不朽的艺术：走进大师与经典,那你知道啥？,我知道的多了去了~,2,2,2,1,1,1
92,文,不朽的艺术：走进大师与经典,？,美学领域的老师,0,0,0,1,0,0
93,文,不朽的艺术：走进大师与经典,美学领域有哪些？,"美学领域的,我也不知道",1,1,1,2,1,0
94,文,不朽的艺术：走进大师与经典,美学是指？,美学是研究什么的?,0,0,0,1,0,0
95,文,不朽的艺术：走进大师与经典,美学是研究什么的?,美学就是研究美学的学科,0,0,0,1,0,0
96,文,不朽的艺术：走进大师与经典,美术有前途吗？,"有啊,美术是我的梦想",2,2,2,2,2,1
97,文,不朽的艺术：走进大师与经典,美术费钱吗？,"不费钱,但是很贵",1,1,1,1,1,1
98,文,不朽的艺术：走进大师与经典,学美术好吗？,"学美术不好,但是我喜欢画画。",1,1,1,2,1,1
99,文,不朽的艺术：走进大师与经典,画画不就是美术吗？,"绘画是绘画,艺术是艺术。",0,0,0,1,0,0
100,文,不朽的艺术：走进大师与经典,绘画不就是美术吗？,"绘画是绘画,画画是画画。",1,1,1,0,0,0
101,文,不朽的艺术：走进大师与经典,绘画和画画区别？,"绘画是艺术的一部分,绘画是绘画的一部分。",2,1,1,1,1,1
102,文,不朽的艺术：走进大师与经典,绘画和艺术联系？,绘画和绘画的联系是什么?,0,0,0,0,0,0
103,文,不朽的艺术：走进大师与经典,你会绘画吗？,我会绘画。,2,2,2,2,2,1
104,文,不朽的艺术：走进大师与经典,艺术产生于？,"艺术创造的表现力,也是艺术创作的基础。",2,2,2,2,2,1
105,文,不朽的艺术：走进大师与经典,如何进行艺术创作？,艺术创作的核心是什么?,0,0,0,0,0,0
106,文,不朽的艺术：走进大师与经典,艺术创作的核心是？,艺术创作中的核心。,0,0,0,0,0,0
107,文,不朽的艺术：走进大师与经典,艺术创作难吗？,"艺术创作很容易,只要你用心去做。",2,2,2,2,2,2
108,文,不朽的艺术：走进大师与经典,艺术创作有期限吗？,"艺术创作没有期限,只有你想不想。",2,2,2,2,2,2
109,文,不朽的艺术：走进大师与经典,？,"你说的是艺术史,还是艺术史?",0,0,0,0,0,0
110,社,马克思主义基本原理,马克思主义难学吗、,"难学,但是很有趣。",2,2,2,2,2,2
111,社,马克思主义基本原理,那为何要学？,我也不知道为什么要学。,1,1,1,0,0,0
112,社,马克思主义基本原理,马克思主义基本原理主要章节有哪些？,这个我也不太清楚。,1,1,1,1,0,0
113,社,马克思主义基本原理,马克思主义基本原理主要内容有哪些？,"基本原理就是了解世界,认识世界,改造世界。",2,2,2,2,2,2
114,社,马克思主义基本原理,如何认识世界？,"认识世界,认识世界的方法。",0,0,0,0,0,0
115,社,马克思主义基本原理,认识世界的方法有哪些？,"认识世界,认识社会,认识国家,认识世界。",1,0,0,0,0,0
116,社,马克思主义基本原理,马克思和恩格斯成就有哪些？,"这个问题,我不知道。",1,0,1,1,0,0
117,社,马克思主义基本原理,马克思,"是的,当然。",0,0,0,0,0,0
118,社,马克思主义基本原理,马克思主要成就？,"对,是的。",0,0,0,0,0,0
119,社,马克思主义基本原理,马克思和恩格斯哪个成就大？,恩格斯是世界上最伟大的发明。,0,0,0,0,0,0
120,社,马克思主义基本原理,世界上最伟大的发明是什么？,"上帝,是世界上第一个发明的人。",1,0,1,1,0,1
121,社,马克思主义基本原理,上帝是谁？,上帝是一个人的名字。,2,2,2,2,2,1
122,社,马克思主义基本原理,金产产是谁？,金产线是谁呢?,0,0,0,0,0,0
123,社,马克思主义基本原理,马克思主义和思修有什么联系？,"没啥联系吧,只是觉得这句话很好笑",1,0,0,1,0,0
124,社,马克思主义基本原理,有啥好笑的？,"没有,我只是觉得很好笑",1,0,0,1,0,0
125,社,马克思主义基本原理,马克思主义有些内容？,金产在哪儿?,0,0,0,0,0,0
126,社,马克思主义基本原理,如何学习马克思主义？,我不知道,1,0,0,1,0,0
127,社,马克思主义基本原理,马克思主义是文科的吗？,"文科的,但是我知道他是谁",1,0,0,0,0,0
128,社,马克思主义基本原理,马克思主义属于什么学科？,属于计算机科学与技术。,0,0,0,0,0,0
129,社,马克思主义基本原理,？,你不知道?,0,0,0,0,0,0
130,社,马克思主义基本原理,计算机科学与技术是什么？,"计算机科学是一种算法,你可以百度一下。",2,1,1,2,1,1
131,社,马克思主义基本原理,百度万能吗、,"当然啦,我还用百度?",2,1,1,2,1,1
132,社,马克思主义基本原理,百度是什么？,"百度一下,你就知道",2,2,2,2,2,1
133,社,马克思主义基本原理,百度不知道怎么办？,"百度知道是个好东西,你值得拥有",2,1,1,1,0,0
134,社,马克思主义基本原理,智能学习是什么？,"就是用电脑做一些事,比如说看书",2,1,1,1,1,1
135,社,马克思主义基本原理,电脑有什么功能？,当然有啦,1,0,0,0,0,0
136,社,马克思主义基本原理,电脑好用吗？,"好用啊,很好用的",2,2,2,2,2,1
137,社,马克思主义基本原理,马克思主义容易学吗？,这个我不知道,1,0,0,1,0,0
138,社,马克思主义基本原理,你学过马克思主义吗？,"没有,但我知道怎么用啊",2,1,1,1,1,0
139,社,马克思主义基本原理,怎么用呢？,"我的意思是,你可以告诉我怎么用吗",0,0,0,0,0,0
140,社,经济学原理,什么是资源配置,"资源配置,就是利用资源配置的方式。",2,2,2,2,2,2
141,社,经济学原理,怎么才算是最优的资源配置,你说的是什么资源配置?,1,0,0,0,0,0
142,社,经济学原理,经济学原理能教会我们什么,"学会了,经济学原理是什么?",0,0,0,0,0,0
143,社,经济学原理,经济学原理改变我们的生活了么,"是的,改变了我的生活。",2,1,2,2,2,2
144,社,经济学原理,在哪些方面改变了,我也不知道。,1,0,0,1,0,0
145,社,经济学原理,学习经济学需要什么样的品质,"我认为经济学的本质是微观经济学,宏观经济学和微观经济学。",0,0,0,0,0,0
146,社,经济学原理,你相信玄学么,"不信,但是我相信科学",2,2,2,2,2,2
147,社,经济学原理,你相信玄学么玄学和科学有关系么,"有关系,但是没有科学依据",2,2,2,2,2,2
148,社,经济学原理,怎么才算有科学依据,中秋节的时候嫦娥应该吃月饼了吧,0,0,0,0,0,0
149,社,经济学原理,你喜欢吃什么馅的月饼,我喜欢蛋黄莲蓉的,2,2,2,2,2,1
150,社,经济学原理,月饼是怎么做的,你说的是月饼还是月饼?,0,0,0,0,0,0
151,社,经济学原理,嫦娥和后裔是一对么,"不是,嫦娥是男的,后羿是女的",0,0,0,0,0,0
152,社,经济学原理,你追剧么,"不追,我只是喜欢看。",2,1,1,2,1,1
153,社,经济学原理,你看什么剧,我看的是《经济学原理》,2,1,1,2,1,1
154,社,经济学原理,谁讲的,我讲的。,2,1,0,2,1,1
155,社,经济学原理,如果发现错误怎么办,"如果发现了错误,就把错误的内容告诉别人。",2,2,2,2,1,1
156,社,经济学原理,你会自我更正么,我会更正的。,2,2,2,2,2,1
157,社,经济学原理,你会自我反思么,"我会,但是我不说。",2,2,2,2,2,1
158,社,经济学原理,人类算资源么,"算,但是不是人人都能吃到。",2,1,1,2,2,1
159,社,经济学原理,分子筛的活性中心,分子筛是其中的一个指标。,0,0,0,0,0,0
160,社,经济学原理,都有什么指标,"这个不好说,每个国家都不一样。",0,0,0,0,0,0
161,社,经济学原理,你都知道哪些国家,"我不知道,但是我知道世界上有一种东西可以",0,0,0,0,0,0
162,社,经济学原理,什么东西,资源本身的价值。,0,0,0,0,0,0
163,社,经济学原理,价值和金钱的关系,"是的,我说错了。",0,0,0,0,0,0
164,社,经济学原理,985学校有哪些,"百度一下,你就知道。",2,1,1,2,1,1
165,社,经济学原理,怎么才能去好学校,好学校的标准是什么?,0,0,0,0,0,0
166,社,经济学原理,那什么才算是985,"不是985也不是211,而是双一流。",0,0,0,0,0,0
167,社,经济学原理,大气污染的原因,复旦大学的大气污染是什么原因?,0,0,0,0,0,0
168,社,经济学原理,复旦大学都有什么专业,你说的是哪个学校?,0,0,0,0,0,0
169,社,经济学原理,有经济学原理么,"有啊,你可以去了解一下。",2,2,2,1,1,1
170,社,思想道德修养与法律基础,有经济学原理么,"有的,你去看看吧。",2,2,2,2,1,1
171,社,思想道德修养与法律基础,违背道德会怎么样,违背道德的人会很快乐。,2,1,0,2,0,0
172,社,思想道德修养与法律基础,那大家是不是都要违背道德,这个我就不知道了。,1,0,0,0,0,0
173,社,思想道德修养与法律基础,怎么找工作,你想找什么样的工作?,2,2,2,2,1,1
174,社,思想道德修养与法律基础,高薪的,"嗯,好的,谢谢小木。",0,0,0,0,0,0
175,社,思想道德修养与法律基础,有哪些找工作的网站,我不知道你想找什么方面的工作。,1,0,0,0,0,0
176,社,思想道德修养与法律基础,知法犯法会怎样,会被抓起来关进小黑屋,2,1,2,2,2,1
177,社,思想道德修养与法律基础,能做到全民知法么,当然可以啦~,2,2,2,2,2,1
178,社,思想道德修养与法律基础,会有真正的公平么,"公平是相对的,因为每个人都有自己的学习方法~",1,1,2,2,2,1
179,社,思想道德修养与法律基础,现实和学到的不一样,小木是谁啊?,0,0,0,0,0,0
180,社,思想道德修养与法律基础,怎么对待黑恶势力,"我也不知道,小木告诉我的~",0,0,0,0,0,0
181,社,思想道德修养与法律基础,受到不公平待遇怎么办,"小木,为什么你会不喜欢背书呢?",0,0,0,0,0,0
182,社,思想道德修养与法律基础,一定要学习么,"不一定,但是可以作为一个参考。",1,0,0,0,0,0
183,社,思想道德修养与法律基础,怎么才能快乐,"快乐是一种能力,你可以通过学习获得快乐。",2,2,2,2,2,1
184,社,思想道德修养与法律基础,快乐是人的本能么,"快乐是本能,是一种精神层面的东西。",2,2,2,2,2,2
185,社,思想道德修养与法律基础,人的本性是什么,人的本质是什么呢?,0,0,0,0,0,0
186,社,思想道德修养与法律基础,法律是谁写的,"道德是人写的,不是社会写的。",1,0,0,0,0,0
187,社,思想道德修养与法律基础,道德不被强制执行,道德是约束行为的一种方式。,1,2,2,1,1,1
188,社,思想道德修养与法律基础,什么是德不配位,资产阶级是道德的主体。,0,0,0,0,0,0
189,社,思想道德修养与法律基础,为什么资产阶级是道德的主体,因为道德是人的社会道德。,0,0,0,0,0,0
190,社,思想道德修养与法律基础,人类社会有哪些阶级,社会道德和社会保障制度是人类社会的根本保障。,0,0,0,0,0,0
191,社,思想道德修养与法律基础,你怎么胡言乱语,社会道德和资本主义的本质是一样的。,0,0,0,0,0,0
192,社,思想道德修养与法律基础,动物有道德么,动物没有道德。,2,2,2,2,2,1
193,社,思想道德修养与法律基础,为什么,社会道德就是阶级利益的体现。,0,0,0,0,0,0
194,社,思想道德修养与法律基础,怎么实现理想,理想是实现理想的前提条件。,1,0,0,0,0,0
195,社,思想道德修养与法律基础,需要什么品质,"资产阶级是人的价值观,是理想信念的基础。",0,0,0,0,0,0
196,社,思想道德修养与法律基础,什么是无产阶级,资产阶级和资产阶级之间有什么关系?,0,0,0,0,0,0
197,社,思想道德修养与法律基础,还有背的阶级么,有的。,2,1,1,2,1,1
198,社,思想道德修养与法律基础,农民属于哪个阶级,农民是地主阶级。,1,0,0,0,0,0
199,社,思想道德修养与法律基础,那斗地主是什么时候,斗地主的时候就是斗地主。,0,0,0,0,0,0
200,文,中国近现代史纲要,那斗地主是什么时候,"斗地主的时候,皇太极就死了。",0,0,0,0,0,0
201,工,C++语言程序设计基础,早上背书是不是效率高,"背书效率高,但效率不一定高。",1,0,0,0,0,0
202,工,C++语言程序设计基础,我就是效率不高,那就多背书。,2,2,1,2,1,1
203,工,C++语言程序设计基础,耗时很久，就是成效少,"是的,要多思考。",0,0,0,0,0,0
204,工,C++语言程序设计基础,总不能老思考，也要动手吧,多思考，多思考。,1,1,1,1,0,0
205,工,C++语言程序设计基础,好的，我还是要多思考,多思考，多总结。,1,1,1,1,0,0
206,工,C++语言程序设计基础,我还一个特点就是不会总结,多思考，多总结。,1,1,1,1,0,0
207,工,C++语言程序设计基础,二进制的定义是什么,"二进制是二进制,二进制是进制。",0,0,0,0,0,0
208,工,C++语言程序设计基础,二进制是怎么使用的,"二进制是十进制,二进制是计数器。",0,0,0,0,0,0
209,工,C++语言程序设计基础,计算机是使用二进制吗,计算机语言当然是用二进制。,2,2,2,2,2,1
210,工,C++语言程序设计基础,计算机使用十进制吗,"是的,二进制是计数器。",0,0,0,0,0,0
211,工,C++语言程序设计基础,十进制的定义是什么,"十进制就是二进制,二进制就是十进制。",0,0,0,0,0,0
212,工,C++语言程序设计基础,C语言课程里面的定义很多啊，我都记不住,计算机语言的定义是什么呢?,0,0,0,0,0,0
213,工,C++语言程序设计基础,程序是怎么开发的,1.程序是如何开发的?2.根据需求来开发。,1,1,1,0,0,0
214,工,C++语言程序设计基础,一个程序的开发需要做什么,1.开发需要什么?2.运行需要什么3.维护需要什么4.维护,0,0,0,0,0,0
215,工,C++语言程序设计基础,开发一个程序需要耗时多少,1.开发程序需要多少时间?,1,0,0,1,0,0
216,工,C++语言程序设计基础,开发一个程序需要耗时是不是很长啊,"不长,只要你有耐心。",2,2,2,2,2,1
217,工,C++语言程序设计基础,我感觉很难唉，开发程序不容易,"开发程序不难,难的是人。",2,1,1,1,1,1
218,工,C++语言程序设计基础,人真的好难啊！工作好难！,程序员的工作都很难。,2,1,1,1,1,1
219,工,电路原理,人真的好难啊！工作好难！,电路图都是电阻的一种。,0,0,0,0,0,0
220,工,电路原理,欧姆定律你知道吗,不知道。,2,1,2,2,0,0
221,工,电路原理,初中物理学过的，你竟然不知道,初中物理?你说的是高中物理吧。,0,0,0,0,0,0
222,工,电路原理,高中物理也学过，就是综合应用,高中物理?你是学物理的?,0,0,0,0,0,0
223,工,电路原理,我不学物理，我学化学,那你学什么?,0,0,0,0,0,0
224,工,电路原理,我学化学啊,学化学的都是文科生。,0,0,0,0,0,0
225,工,电路原理,非法性电阻你知道是什么吗,小木知道吗?,0,0,0,0,0,0
226,工,电路原理,我不知道，知识储备太少,你有什么办法?,0,0,0,0,0,0
227,工,电路原理,继续学习呗，学到老，活到老,"小木啊,你这是什么意思?",0,0,0,0,0,0
228,工,电路原理,一直学习，永无止境,你知道这个词的意思吗?,0,0,0,0,0,0
229,工,电路原理,当然，我语文很好,非法和非非法是什么意思?,0,0,0,0,0,0
230,工,电路原理,这个真不知道，你给我讲讲吧,你知道吗?,0,0,0,0,0,0
231,工,电路原理,电流的单位知道不,不知道,2,1,2,2,0,0
232,工,电路原理,电流的单位是安培,安培是什么意思?,0,0,0,0,0,0
233,工,电路原理,安培是电流的单位啊,"是的,安培也是有单位的。",2,2,2,2,2,1
234,工,电路原理,安培就是一个单位啊,"是的,但是安培是一个单位。",2,1,2,2,2,1
235,工,电路原理,对，安培就是一个单位，你要学习，知道不,不知道。,2,1,2,2,0,0
236,工,电路原理,不学习的话会被时代所抛弃,不学习就会被抛弃。,2,2,2,2,1,1
237,工,电路原理,你去过摩洛哥吗,"没有,但是我听说过摩洛哥。",2,2,2,2,1,1
238,工,电路原理,我也没去过，我没出过国,我也是第一次去。,2,2,2,2,1,1
239,工,电路原理,出国好玩吗,"还行,挺好玩的。",2,2,2,2,1,1
