,category,course,query,answer,coherence,informativeness,hallucination,humanness,helpfulness,instructiveness
240,工,电路原理,有机会我也要去看看,"嗯,有机会可以去看看。",2,2,2,2,1,1
241,工,电路原理,世界那么大，真的需要去看看,"世界这么大,我想去看看。",2,1,2,2,1,1
242,工,电路原理,走吧，时不待人,"我说的是时间序列,不是时间。",0,0,0,0,0,0
243,工,电路原理,现在电车的销量很好,现在的电动汽车销量也很好。,2,1,2,2,0,0
244,工,电路原理,特斯拉电车在中国降价了,特斯拉电动汽车在哪儿呢?,0,0,0,0,0,0
245,工,电路原理,在他的工厂啊,"是的,在他厂里。",2,1,1,2,1,1
246,工,电路原理,最近，新能源领域很好，可以投资,新能源行业已经很好了。,2,1,1,2,1,1
247,工,电路原理,电车的电池性能还有待提高,"是的,电动汽车的电池技术已经很好了。",2,1,1,1,1,1
248,工,电路原理,电车电池的续航还是少,这个问题我已经回答过了。,2,1,1,1,1,0
249,其,生活英语读写,电车电池的续航还是少,小木的答复是:不知道~,2,1,2,2,0,0
250,其,生活英语读写,生活英语读写讲的什么啊,"生活英语,这个我不知道哦~你可以去网上搜一下",2,0,1,2,0,0
251,其,生活英语读写,好的，我去百度,"嗯嗯,好的~",2,2,2,2,1,1
252,其,生活英语读写,百度真是一个好东西，他什么都知道,"是的哦,而且你也可以看出来",2,2,2,2,1,1
253,其,生活英语读写,对啊，我不会的都去问百度,"你可以在百度上搜索""高效学习,就可以看到了~",1,1,2,2,1,1
254,其,生活英语读写,你搜过吗，给我讲讲呗,"我没搜过哦~但是你可以去看一下,有好多的",1,1,2,2,1,1
255,其,生活英语读写,我英语成绩太差了,"小木,你是最棒的。",1,1,1,1,0,1
256,其,生活英语读写,英语好难学啊,"小木,你知道吗?",0,0,0,0,0,0
257,其,生活英语读写,我不知道啊，为什么英语这么难,"小木,你的英语很好吗?",0,0,0,0,0,0
258,其,生活英语读写,不好，刚刚及格,"小木,你是最棒的。",1,1,1,1,0,1
259,其,生活英语读写,谢谢你的鼓励,"小木,你是个好孩子。",0,1,1,1,0,1
260,其,生活英语读写,我一直都是父母的乖乖女,"小木,你是一个好妈妈。",0,0,0,0,0,0
261,其,生活英语读写,why是什么意思,"why是""he""的意思,她是男生。",0,0,0,0,0,0
262,其,生活英语读写,why是为什么的意思,"因为he的意思是he,she的意思就是he。",0,0,0,0,0,0
263,其,生活英语读写,你要好好背英语,"好的,我会的。",2,2,2,2,2,2
264,其,生活英语读写,单词是英语的基础,"单词是基础,但是不是最重要的。",2,1,2,2,2,2
265,其,生活英语读写,不背单词是看不懂一句话的,那你看懂了吗?,0,0,0,0,0,0
266,其,生活英语读写,我当然了，我正在背单词,"我也在背单词,一起加油吧。",2,2,2,2,2,2
267,其,生活英语读写,你好聪明，举一反三,"我只是想知道,你为什么会这么问。",0,0,0,1,0,0
268,其,生活英语读写,感觉啊，你看起来就聪明,"是吧,我也这么觉得。",2,2,2,2,1,1
269,其,生活英语读写,对啊，你要自信,"自信是什么,这个词我不知道。",0,0,0,1,0,0
270,其,生活英语读写,自信就是不惧怕任何事，有一往无前的勇气,"你有什么自信,我就有什么勇气。",2,1,2,2,1,1
271,其,生活英语读写,我就不自信,"你不自信,我就更不自信了。",2,1,2,2,1,1
272,其,生活英语读写,你比我厉害，你真的很棒,"谢谢夸奖,我只是个初学者。",2,2,2,2,2,1
273,其,生活英语读写,你在背单词吗,"我在背英语单词,你呢?",2,2,2,2,2,2
274,其,生活英语读写,我也在背单词,你是英语专业的吗?,0,0,0,1,0,0
275,其,生活英语读写,我不是英语专业,那你是什么专业的?,0,0,0,1,0,0
276,其,生活英语读写,我不是化工专业的,那你是什么专业的?,0,0,0,1,0,0
277,其,生活英语读写,我学习化工，要去化工厂,你学化工?你学化学?,0,0,0,1,0,0
278,其,生活英语读写,对，两个都学了，差不多,我也是学的这个,2,2,2,2,2,2
279,理,逻辑学概论,逻辑学概论好学吗,"好学,但是很枯燥。",2,2,2,2,2,2
280,理,逻辑学概论,逻辑学概论主要讲的是什么,逻辑学导论,2,2,2,2,2,1
281,理,逻辑学概论,逻辑学导论是什么,"统计学导论,是一本书。",1,1,1,1,1,1
282,理,逻辑学概论,逻辑学和统计学有什么关系,"逻辑学的研究对象是数学,统计学只是其中一个学科。",2,2,2,2,2,2
283,理,逻辑学概论,逻辑学有什么方法,逻辑学的基本原理是什么?,0,0,0,0,0,0
284,理,逻辑学概论,怎样才能学好逻辑学,"先学逻辑学,再学数学。",2,2,2,2,2,2
285,理,逻辑学概论,学逻辑学需要准备好什么,小木已经为你解答了哦~希望能帮到你~,0,0,0,0,0,0
286,理,逻辑学概论,学逻辑学有什么推荐的课本,小木推荐的逻辑学基础课程,2,2,2,2,2,2
287,理,逻辑学概论,学逻辑学有什么推荐的网课,小木推荐的《逻辑学导论》和《逻辑哲学概论》,2,2,2,2,2,2
288,理,逻辑学概论,逻辑学导论是谁写的,小木同学~,0,0,0,0,0,0
289,理,逻辑学概论,逻辑学导论是中文还是英文,"中文的哦,呵呵~",2,2,2,2,2,2
290,理,逻辑学概论,逻辑学导论主要讲的是什么,"逻辑学,导论,逻辑学~",1,1,1,1,1,0
291,理,逻辑学概论,什么是思维形式,"思维方式,逻辑化的表现。",2,2,2,2,2,2
292,理,逻辑学概论,有效推理形式有哪些,"比如说,推理是一种思维方式。",2,2,2,2,2,2
293,理,逻辑学概论,推理为什么是思维方式,"因为推理是一种思维,它可以用逻辑来解释。",2,2,2,2,2,2
294,理,逻辑学概论,推理是什么样的思维定势,推理是一种思维模式。,1,1,1,1,1,0
295,理,逻辑学概论,思维模式是什么,"逻辑学中的思维模式,就是把推理和实践结合起来。",2,2,2,2,2,2
296,理,逻辑学概论,怎么把推理和实践联系起来,实践是检验真理的唯一标准。,2,2,2,2,2,2
297,理,逻辑学概论,论证和论据有什么关系,论证和论证的关系是什么?,0,0,0,0,0,0
298,理,逻辑学概论,中国古代思想是逻辑学吗,逻辑学包括了逻辑学。,2,1,1,1,1,1
299,理,逻辑学概论,矛盾是什么,"矛盾是一种现象,而不是一种状态。",2,2,2,2,2,2
300,理,逻辑学概论,矛盾为什么是一种现象,"矛盾是客观存在的,而非主观臆断。",2,2,2,2,2,2
301,理,逻辑学概论,矛盾为什么是客观存在的,"矛盾是存在的,矛盾是客观的。",2,2,2,2,2,2
302,工,软件工程,不会编程，怎么入门？,"多读书,多看报,少吃零食,多睡觉。",0,0,0,0,0,0
303,工,软件工程,能不能给一些实际的建议？,"多读书,多看报,少吃零食,多睡觉。",0,0,0,1,0,0
304,工,软件工程,有没有推荐的参考书？,"我也不知道啊,你可以去图书馆看看。",0,0,0,1,0,0
305,工,软件工程,软件工程这门课重点内容是什么？,"计算机的核心是信息,逻辑,算法。",2,2,2,2,2,1
306,工,软件工程,计算机语言是不是很难学？,"不难学,只要你有兴趣。",2,2,2,2,2,1
307,工,软件工程,计算机语言有哪几种？,计算机语言主要有java、python、php、c语言、java、c,2,2,2,2,2,1
308,工,软件工程,编程最常用的是哪一种语言？,"java,c,c+都可以。",2,2,2,2,2,1
309,工,软件工程,编程有哪些步骤？,"编程有很多步骤,主要是程序。",2,2,2,2,2,2
310,工,软件工程,程序设计包括那些方面？,软件工程包括很多方面。,2,1,2,2,2,1
311,工,软件工程,软件工程更侧重于程序开发？,是的。,2,2,2,2,2,1
312,工,软件工程,程序开发最重要的是编写程序吗？,是的。,2,2,2,2,2,1
313,工,软件工程,面向对象的含义是什么？,面向对象是为了更好的服务对象。,0,0,0,0,0,0
314,工,软件工程,面向过程又是什么意思？,面向过程就是面向对象编程的过程。,2,2,2,2,2,1
315,工,软件工程,对象可以分为哪几类？,"对象是一类,对象的对象。",0,0,0,0,0,0
316,工,软件工程,类和对象有什么区别？,"对象是对象,对象也是对象。",0,0,0,0,0,0
317,工,软件工程,同特征的对象可以被归为类吗？,"可以归为,但是不属于。",2,2,2,2,2,2
318,工,软件工程,确认一个类有什么意义？,源代码的意思是:python是一个程序。,0,0,0,0,0,0
319,工,软件工程,如何引用函数？,用函数就可以引用函数调用的函数。,0,0,0,0,0,0
320,工,软件工程,如何实现函数调用？,调用函数调用的方法有很多。,1,0,0,0,0,0
321,工,软件工程,析构函数是什么形式？,"包括分析函数的内容,包括构造函数的形式。",0,0,0,0,0,0
322,工,软件工程,构造函数有哪几类？,构造函数包括c语言、java、c+等多种语言。,2,2,2,2,2,1
323,工,软件工程,什么时候要用到构造函数？,这个我也不太清楚。,1,0,0,0,0,0
324,工,软件工程,函数库里的函数如何调用？,调用函数的方法有很多。,1,0,0,0,0,0
325,工,软件工程,如何发现bug？,"比如说,程序运行中出现了bug,这种情况下,应该怎么办?",0,0,0,0,0,0
326,工,软件工程,软件测试有哪些步骤？,程序员的步骤就是测试程序。,0,0,0,0,0,0
327,工,软件工程,测试程序需要注意什么？,"需要注意的就是,测试程序必须要有一定的编程基础。",2,2,2,2,2,2
328,工,软件工程,程序维护要求有哪些？,这个我也不太清楚。,1,0,1,1,0,0
329,工,软件工程,软件需求设计有没有必要的步骤？,有必要的。,1,0,1,1,0,0
330,工,软件工程,可行性分析如何运用？,"可行性分析就是将它们组合在一起,以便能够了解更多信息。",1,0,0,0,0,0
331,工,软件工程,可行性分析如何运用？,"可行性分析就是多沟通,多实践。",1,1,0,0,0,0
332,文,毛泽东思想与中国特色社会主义理论体系概论,可行性分析如何运用？,"谢邀,这个我也不知道",1,1,1,2,0,0
333,文,毛泽东思想与中国特色社会主义理论体系概论,这门课怎么考试？,我想知道这门课是怎么考试的?,0,0,0,0,0,0
334,其,日语与日本文化,如何高效学习一门语言？,"小木,为什么你的""学习方法""如此简单?",0,0,0,0,0,0
335,其,日语与日本文化,日语有哪些学习技巧？,"多看动漫,多听广播剧~",1,1,1,1,0,0
336,其,日语与日本文化,日语常用语有哪些？,"我只知道""学习""这个词",0,0,0,0,0,0
337,其,日语与日本文化,学习用日语怎么说？,"日语:学习用语""学习""的意思。",0,0,0,0,0,0
338,其,日语与日本文化,日语是不是包含很多中文词汇？,"是的,包含了很多。",2,1,2,2,1,0
339,其,日语与日本文化,如何学好日语？,"小木,为什么你的帖子这么火?",0,0,0,0,0,0
340,其,日语与日本文化,我不懂日语，会不会学不会？,"当然会啊,日语很简单的。",2,2,2,2,2,1
341,其,日语与日本文化,那还怎么学日语？,小木是日语专业毕业的。,0,0,0,0,0,0
342,其,日语与日本文化,你有什么学习经验吗,"没有,但是我会努力学习的。",0,0,0,1,0,1
343,其,日语与日本文化,日语有哪些特点？,"日语的特点就是,语感好。",2,2,2,2,2,1
344,其,日语与日本文化,日语语序是怎么样的？,日语的语序都是很简单的。,1,0,0,0,0,0
345,其,日语与日本文化,日语抱歉有几种说法？,"一种说法,就是你的学习能力强。",1,0,0,1,0,0
346,其,日语与日本文化,日语抱歉怎么说？,这个我也不知道怎么说,1,0,0,1,0,0
347,其,日语与日本文化,さようなら是什么意思？,ありがとございます。,0,0,0,0,0,0
348,其,日语与日本文化,こんにちは是你好吗,ありがとうございます,0,0,0,0,0,0
349,其,日语与日本文化,平假名片假名有什么区别？,"平假字是形容词,不是名词。",0,0,0,0,0,0
350,其,日语与日本文化,日语中娘是母亲吗,是的。,2,2,1,2,2,1
351,其,日语与日本文化,女孩用日语怎么说？,女孩子用日文怎么说呢?,0,0,0,0,0,0
352,其,日语与日本文化,平假名怎么来的？,平假姓名的由来。,0,0,0,0,0,0
353,其,日语与日本文化,片假名是拼音吗？,是拼音。,2,2,2,2,2,1
354,其,日语与日本文化,日语语法有哪些特点？,日语里的语序都是这样的。,0,0,0,0,0,0
355,其,日语与日本文化,日语语序和汉语接近？,不接近。,2,2,2,2,2,2
356,其,日语与日本文化,日语里主语在前面还是后面？,主语。,0,0,0,0,0,0
357,其,日语与日本文化,日语也分主谓宾定状补吗？,是的。分主语和宾语。,2,2,2,2,2,2
358,其,日语与日本文化,日本历史书有哪些？,汉字的史书记载了从0到1的历史。,0,0,0,0,0,0
359,其,日语与日本文化,日本有多少年历史？,0-0年的历史。,0,0,0,0,0,0
360,其,日语与日本文化,日语什么时候诞生的？,日语的诞生是从公元前2世纪开始的。,2,2,2,2,2,1
361,其,日语与日本文化,唐朝谁去了日本？,这个我就不知道了。,1,1,1,1,0,0
362,其,日语与日本文化,日本史学家有哪几类,汉书后汉书西汉书,0,0,0,0,0,0
363,其,日语与日本文化,日本史学家有哪几位,万叶册是由汉字书写的。,0,0,0,0,0,0
364,其,日语与日本文化,日本史学家有哪几位,"这个我不知道哦,你可以去网上搜搜看~",1,1,1,2,1,0
365,文,毛泽东思想与中国特色社会主义理论体系概论,日本史学家有哪几位,"这个不好说,得看具体的历史书。",0,0,0,0,0,0
366,文,毛泽东思想与中国特色社会主义理论体系概论,这门课有哪些内容？,这个我也不太清楚。,1,0,1,1,0,0
367,文,毛泽东思想与中国特色社会主义理论体系概论,这门课是关于思想政治吗？,是的。,2,2,2,2,2,1
368,文,毛泽东思想与中国特色社会主义理论体系概论,这门课最后如何考试？,这个就不知道了。,1,1,1,2,1,0
369,文,毛泽东思想与中国特色社会主义理论体系概论,有问题可以找助教吗？,可以。,2,2,2,2,2,1
370,文,毛泽东思想与中国特色社会主义理论体系概论,毛泽东思想核心是什么？,"思想的核心,就是思想。",0,0,0,0,0,0
371,文,毛泽东思想与中国特色社会主义理论体系概论,中国特色社会主义理论体系包含哪几部分？,包括一些基本的知识。,0,0,0,0,0,0
372,文,毛泽东思想与中国特色社会主义理论体系概论,论持久战写于啊一年,这个应该很好写吧。,0,0,0,0,0,0
373,文,毛泽东思想与中国特色社会主义理论体系概论,论持久战写于哪年,"哦,那我也想知道。",0,0,0,0,0,0
374,文,毛泽东思想与中国特色社会主义理论体系概论,沁园春雪的写作背景是什么,她的写作是什么?,0,0,0,0,0,0
375,文,毛泽东思想与中国特色社会主义理论体系概论,人民当家作主是说人民是国家主人吗,"是的,当然是国家的主人。",2,2,2,2,2,1
376,文,毛泽东思想与中国特色社会主义理论体系概论,如何实现人民民主专政？,这个我不知道。,1,0,1,1,0,0
377,文,毛泽东思想与中国特色社会主义理论体系概论,三个代表重要思想是哪三个代表？,我不太了解。,1,0,1,1,0,0
378,文,毛泽东思想与中国特色社会主义理论体系概论,改革开放从哪一年开始？,从1949年开始。,2,2,2,2,2,1
379,文,毛泽东思想与中国特色社会主义理论体系概论,改革开放伟大意义是什么？,改革开放的意义?,0,0,0,0,0,0
380,文,毛泽东思想与中国特色社会主义理论体系概论,为什么中国要改革开放？,为什么?,0,0,0,0,0,0
381,文,毛泽东思想与中国特色社会主义理论体系概论,改革开放建立了经济特区吗,是的。,2,2,2,2,1,0
382,文,毛泽东思想与中国特色社会主义理论体系概论,深圳崛起时间是？,1949年5月1日。,2,2,2,2,2,1
383,文,毛泽东思想与中国特色社会主义理论体系概论,中国特色社会主义有哪些特点？,我不清楚。,1,1,1,1,0,0
384,文,毛泽东思想与中国特色社会主义理论体系概论,如何适应时代潮流？,我不明白你的意思。,1,1,1,1,0,0
385,文,毛泽东思想与中国特色社会主义理论体系概论,中国国情发生了哪些变化？,这个问题下面的答案都是些什么鬼?,0,0,0,0,0,0
386,文,毛泽东思想与中国特色社会主义理论体系概论,如何摆脱绝对贫困？,"""绝对贫困""这个词用的好。",0,0,0,0,0,0
387,文,毛泽东思想与中国特色社会主义理论体系概论,中国如何实现脱贫攻坚？,不知道。,1,1,1,1,0,0
388,文,毛泽东思想与中国特色社会主义理论体系概论,民主集中制具体体现在？,全面小康社会。,0,0,0,0,0,0
389,文,毛泽东思想与中国特色社会主义理论体系概论,我国实现全面小康了吗,你的意思是。全面小康?,0,0,0,0,0,0
390,文,毛泽东思想与中国特色社会主义理论体系概论,第二个百年奋斗目标是？,脱贫致富。,2,2,2,2,2,1
391,文,毛泽东思想与中国特色社会主义理论体系概论,实践是检验真理的唯一标准吗,实践是不断进步的过程。,2,1,2,2,2,1
392,文,毛泽东思想与中国特色社会主义理论体系概论,毛泽东思想是对马克思主义思想进行了借鉴改良？,这个我不太清楚。,1,0,1,1,0,0
393,文,毛泽东思想与中国特色社会主义理论体系概论,依法治国总目标如何实现？,全面小康。,0,0,0,0,0,0
394,文,毛泽东思想与中国特色社会主义理论体系概论,宪法高于一切？,"不,更多的是对个人的解放。",0,0,0,0,0,0
395,文,毛泽东思想与中国特色社会主义理论体系概论,宪法高于一切？,"是的,长官。",2,2,2,2,2,1
396,文,毛泽东思想与中国特色社会主义理论体系概论,如何用先进思想武装头脑？,"你知道吗,长官?",0,0,0,0,0,0
397,文,毛泽东思想与中国特色社会主义理论体系概论,人民群众是历史的创造者吗,是的。,2,2,2,2,2,1
398,文,毛泽东思想与中国特色社会主义理论体系概论,可持续发展如何实现？,"长官,我的意思是.",0,0,0,0,0,0
399,文,毛泽东思想与中国特色社会主义理论体系概论,绿水青山就是金山银山是说环保重要性？,是的!,0,0,0,0,0,0
400,文,毛泽东思想与中国特色社会主义理论体系概论,如何实现低碳生活？,"你有什么建议吗,先生?",0,0,0,0,0,0
401,文,毛泽东思想与中国特色社会主义理论体系概论,抗美援朝有哪些历史意义？,我不知道。,1,1,1,1,0,0
402,文,中国近现代史纲要,皇太极的事迹,皇太极是他弟弟?,0,0,0,0,0,0
403,文,中国近现代史纲要,他弟弟是谁,"不知道,只知道他是皇亲国戚",1,0,0,1,0,0
404,文,中国近现代史纲要,皇亲国戚的权力,皇太极是皇亲王的儿子,0,0,0,0,0,0
405,文,中国近现代史纲要,当皇帝好么,皇太极是皇亲国戚,0,0,0,0,0,0
406,文,中国近现代史纲要,怎么才能拥有权力,这个我不知道。,1,0,1,1,0,0
407,文,中国近现代史纲要,不喜欢历史怎么办,那就不看呗。,2,1,1,2,0,0
408,文,中国近现代史纲要,不想挂科,"挂了就挂了吧,我也挂了。",1,0,1,2,0,0
409,文,中国近现代史纲要,你怎么这么摆烂,"因为清朝的皇帝太多了,所以清朝就有十二位皇帝",0,0,0,0,0,0
410,文,中国近现代史纲要,学历史有什么用,"学历史的人多了去了,你不知道?",0,0,0,0,0,0
411,文,中国近现代史纲要,人多怎么了,"清朝皇帝多,但是没有皇位。",0,0,0,0,0,0
412,文,中国近现代史纲要,那就打架啊,"清朝没有皇帝,只有一个皇帝。",0,0,0,0,0,0
413,文,中国近现代史纲要,那民国人都有谁,清朝中期之前的皇帝有哪些人?,0,0,0,0,0,0
414,文,中国近现代史纲要,你认识孙中山么,"不认识,但我知道孙山",1,0,1,2,0,0
415,文,中国近现代史纲要,你认识孙山是谁,孙山就是孙山,1,0,1,1,0,0
416,文,中国近现代史纲要,他做了什么,他做什么了?,0,0,0,0,0,0
417,文,中国近现代史纲要,近代的划分,新的划分是什么意思?,0,0,0,0,0,0
418,文,中国近现代史纲要,时代的划分,历史上的清朝已经灭亡了,0,0,0,0,0,0
419,文,中国近现代史纲要,什么时候算新时代,这我就不知道了,0,1,1,2,0,0
420,文,中国近现代史纲要,袁世凯后来的命运,袁世凯的命运是被小木改变了吗?,0,0,0,0,0,0
421,文,中国近现代史纲要,孙中山同期的人物都有谁,袁世凯、袁隆平、袁崇焕、袁承志,0,0,0,0,0,0
422,文,中国近现代史纲要,讲讲袁隆平吧,袁世凯的贡献可是很大的。,0,0,0,0,0,0
423,文,中国近现代史纲要,你是不是只知道袁世凯,"我知道他,但是不了解他。",2,1,1,2,0,0
424,文,中国近现代史纲要,他怎么窃取了革命果实,"袁世凯,袁隆平,袁崇焕。",0,0,0,0,0,0
425,文,中国近现代史纲要,鲁迅的作品有哪些,鲁迅的《枪炮、病菌与钢铁》,2,1,1,2,2,1
426,文,中国近现代史纲要,鲁迅和胡适谁的作品多,"胡适的作品更多,鲁迅的作品比较少。",2,2,2,2,2,1
427,文,中国近现代史纲要,谁的影响力大,"胡适的历史贡献大,影响力也大。",2,2,2,2,2,2
428,文,中国近现代史纲要,胡适的政治地位,是的。胡适的历史地位非常高。,2,1,1,2,1,1
429,文,中国近现代史纲要,后来胡适的结局是什么,"没有结局,他一直都在走下坡路。",0,0,0,0,0,0
430,文,中国近现代史纲要,为什么会走下坡路,"因为他是个商人,而不是一个文人。",2,2,2,2,2,1
431,文,唐宋词鉴赏,为什么会走下坡路,我不知道。,1,0,1,2,0,0
432,文,唐宋词鉴赏,最著名的宋词是什么,宋词中最有名的是《春江花月夜。,2,2,2,2,2,1
433,文,唐宋词鉴赏,什么叫词,我也不知道什么是词。,1,0,1,2,0,0
434,文,唐宋词鉴赏,春江花月夜谁写的,"我说的是宋词,不是诗词。",0,0,0,0,0,0
435,文,唐宋词鉴赏,杜甫的诗词有哪些,你想知道什么?,0,0,0,0,0,0
436,文,唐宋词鉴赏,李白是哪个朝代,"李白是唐朝的,宋代应该是清朝吧",1,0,1,1,0,0
437,文,唐宋词鉴赏,怎么鉴赏唐宋词,"我觉得你的意思是,在律化这个词中,你可以用它来作为自己的代名词。",0,0,0,0,0,0
438,文,唐宋词鉴赏,说一首李白的诗词,"李白的诗,我最喜欢的一首。",0,0,0,0,0,0
439,文,唐宋词鉴赏,李白最出名的诗词是那一首,"李白的诗,醉后不知天在水,满船清梦压星河",1,1,1,1,1,0
440,文,唐宋词鉴赏,女诗人有谁,你是女诗人吗?,0,0,0,0,0,0
441,文,唐宋词鉴赏,介绍一下李清照,"在这个社区里,你可以认识到很多志同道合的朋友。",0,0,0,0,0,0
442,文,唐宋词鉴赏,唐词宋词的区别,"唐词是宋词,宋词是律化。",0,0,0,0,0,0
443,文,唐宋词鉴赏,原来是大梦一场,"大梦几时休,此恨绵绵无绝期。",0,0,0,0,0,0
444,文,唐宋词鉴赏,不知天上宫阙,"你可以百度一下,我也不知道。",0,0,0,0,0,0
445,文,唐宋词鉴赏,举杯邀明月,"明月几时有,把酒问青天。",0,0,0,0,0,0
446,文,唐宋词鉴赏,你知道什么关于理想的诗词么,不知道。,1,0,1,2,0,0
447,文,唐宋词鉴赏,你真蠢,你才蠢。,1,1,2,2,0,0
448,文,唐宋词鉴赏,骂人倒是会的很,你也学会了吗?,1,1,2,2,0,0
449,文,唐宋词鉴赏,学诗词有什么用,你可以百度一下五言律。,1,1,1,2,1,0
450,文,唐宋词鉴赏,词的起源,"这个我知道,但是为什么叫小木?",1,0,1,2,0,0
451,文,唐宋词鉴赏,因为你呆头呆脑,"你才呆脑呢,我只是喜欢小木",1,1,2,2,0,0
452,文,唐宋词鉴赏,那你知道呼儿将出换美酒的下一句么,不知道,1,0,1,2,0,0
453,文,唐宋词鉴赏,我想知道李贺的故事,李贺是个传奇人物。,2,2,2,2,2,1
454,文,唐宋词鉴赏,他写过什么诗,"五言绝句,好像是。",2,1,1,2,1,0
455,文,唐宋词鉴赏,黑云压城城欲摧,"我写的是杜甫,不是李杜。",0,0,0,0,0,0
456,文,唐宋词鉴赏,怎么才能学会写诗词,"我也不知道,我也在学",1,0,1,2,0,0
457,文,唐宋词鉴赏,有什么经验,"没有经验,只是看到了",1,1,1,2,1,0
458,文,唐宋词鉴赏,怎么减肥,我只知道杜甫是个胖子,0,0,0,0,0,0
459,文,唐宋词鉴赏,杜甫吃的很多么,"吃的不多,但是很能吃",1,0,0,1,1,0
460,文,唐宋词鉴赏,你见过？,我见过李白写的诗。,1,0,0,1,1,0
461,社,体育与社会,当然了，运动对身体有好处,"是的,但是要坚持。",2,2,2,2,1,1
462,社,体育与社会,坚持好难啊,"不难,只要你坚持下去。",2,2,2,2,2,1
463,社,体育与社会,怎么不难，都说贵在坚持,"是的,贵在坚持。",1,1,1,1,1,1
464,社,体育与社会,我就不能坚持一个事,你能坚持什么事?,0,0,0,0,0,0
465,社,体育与社会,什么都不太行,那你的意思是什么都可以?,0,0,0,0,0,0
466,社,体育与社会,是，不好的意思,"你可以理解为,你的课程主要是在讲""智能化导学。",0,0,0,0,0,0
467,社,体育与社会,锻炼时间过长会怎么样,"这个我也不知道,每个人情况不一样。",1,0,1,2,0,0
468,社,体育与社会,我最近在锻炼，腿很疼,"你可以先休息一下,然后再继续。",2,2,2,2,2,1
469,社,体育与社会,不能休息，要减肥的,"嗯,是的,这个我也知道。",2,2,2,2,2,1
470,社,体育与社会,减肥好难,"是的,减肥是个持久战。",2,2,2,2,2,2
471,社,体育与社会,减肥好难我怕坚持不下去了,坚持下去就好了。,2,2,2,2,2,1
472,社,体育与社会,怎么坚持呢,"这个,我也不知道。",1,0,1,2,0,0
473,社,体育与社会,怎么坚持呢我想减肥有什么体育项目推荐,"跑步,游泳,爬山,看书,运动。",2,2,2,2,2,1
474,社,体育与社会,跑步岔气了怎么办,岔气是什么意思?,0,0,0,0,0,0
475,社,体育与社会,不知道怎么解释,打麻将也是娱乐方式之一。,0,0,0,0,0,0
