,category,course,query,answer,coherence,informativeness,hallucination,humanness,helpfulness,instructiveness
476,社,体育与社会,打麻将一直坐着，不能减肥吧,"可以的,但是要适量。",2,1,1,2,1,0
477,社,体育与社会,打麻将不是好的运动形式,"打麻将也是运动,只是娱乐方式不同而已。",2,1,1,2,1,1
478,社,体育与社会,还是跑步吧，跑步健康,"是的,跑步是最好的运动。",2,2,2,2,2,1
479,社,体育与社会,奥运会里面有什么体育项目,"有啊,比如篮球、足球、乒乓球、羽毛球等。",2,2,2,2,2,1
480,社,体育与社会,乒乓球是国球，我们打的真厉害,"我们打乒乓球的时候,你在干什么?",0,0,0,0,0,0
481,社,体育与社会,我在看书,我也在看。,2,2,2,2,2,1
482,社,体育与社会,看书可是一个好习惯,"是的,我看书也是一个习惯。",2,2,2,2,2,1
483,社,体育与社会,你最近在看什么书,我看的是《环球人物》这本书。,2,2,2,2,2,1
484,社,体育与社会,环球人物是不是讲的都是伟人,"是的,伟人都是伟大的。",2,2,2,2,2,1
485,社,体育与社会,最近乒乓球比赛，我国得了好多金牌,"好吧,我不懂。",2,1,2,2,2,1
486,社,体育与社会,金牌啊！好厉害啊,这个怎么厉害了?,0,0,0,0,0,0
487,社,体育与社会,金牌代表了为国增光,"好的,谢谢!",0,0,0,0,0,0
488,社,体育与社会,我体育不好，没有天赋,你的天赋是什么?,0,0,0,0,0,0
489,社,体育与社会,我的天赋是唠嗑,唠嗑是什么意思?,0,0,0,0,0,0
490,社,体育与社会,有事没事都说点,"好的,谢谢。",0,0,0,0,0,0
491,工,C++语言程序设计基础,有事没事都说点,"嗯嗯,好的!",0,0,0,0,0,0
492,工,C++语言程序设计基础,C语言课程怎么预习啊,"这个我也不知道,我是自学的",1,0,1,2,0,0
493,工,C++语言程序设计基础,自学，好厉害啊,"没有啦,只是有兴趣而已!",2,1,1,2,0,0
494,工,C++语言程序设计基础,有什么学习技巧吗,"有啊,背书的时候要集中注意力。",2,2,2,2,2,2
495,工,C++语言程序设计基础,我最不爱背书了,"我也不喜欢,可是要背啊!",1,0,1,2,0,0
496,工,C++语言程序设计基础,背书好难啊，我记不住,多做题就好了!,2,2,2,2,2,2
497,工,C++语言程序设计基础,例题看懂了，但是不会做题，怎么办,"多做,多看,多练。",2,2,2,2,2,2
498,工,C++语言程序设计基础,我是不会融会贯通啊,"多做题,多思考。",2,2,2,2,2,2
499,工,C++语言程序设计基础,思而不学则殆,这个我知道。,1,0,1,2,0,0
500,工,C++语言程序设计基础,总的来说是没有形成自己的学习方法,"多做题,多看书,多思考。",1,1,2,1,1,0
501,工,C++语言程序设计基础,我要总结自己的经验，形成答题逻辑,你总结的很好。,1,1,2,2,0,2
502,工,C++语言程序设计基础,谢谢夸奖，我还要努力,"加油,你是最棒的。",1,1,2,2,0,0
503,理,逻辑学概论,举个例子说明同一律,"逻辑学研究的是思维方式,而非逻辑。",0,0,0,0,0,0
504,理,逻辑学概论,命题联结词是什么,命题联接词,0,0,0,0,0,0
505,理,逻辑学概论,命题是什么,命题联接词是什么呢?,0,0,0,0,0,0
506,理,逻辑学概论,命题和反命题是什么关系,"命题联句中,它们是相通的。",2,2,2,2,2,1
507,理,逻辑学概论,否定之否定规律是什么,否定之反命题是否定的规律。,2,2,2,2,2,2
508,理,逻辑学概论,逻辑学概论是什么,"逻辑学是什么,我不知道。",1,0,0,2,0,0
509,理,逻辑学概论,逻辑学怎么学,逻辑学是数学的分支学科。,0,0,0,1,0,0
510,理,大学物理1,逻辑学怎么学,大学物理和大学物理不是一回事。,1,2,2,1,1,0
511,理,大学物理1,大学物理难学吗,"不难学,只要你有兴趣。",2,2,2,2,2,1
512,理,大学物理1,力学是什么,力学是物理学的基础。,2,2,2,2,2,2
513,理,大学物理1,热学是什么,热学就是物理的一种。,2,2,2,2,2,2
514,理,大学物理1,电磁学是什么,"电磁学包括电磁场,电磁场包括量子场。",2,2,2,2,2,2
515,理,大学物理1,光学是什么,光学是数学的基础。,2,1,1,2,2,1
516,理,大学物理1,原子物理怎么学,原子物理的基础是什么?,0,0,0,0,0,0
517,理,大学物理1,光学是什么,"光学是一种光学现象,在物理学中可以理解为一种物理现象。",2,2,2,2,2,2
518,理,大学物理1,近代物理讲的主要是什么,主要是对物理的理解和应用。,2,2,2,2,2,2
519,理,大学物理1,物理怎么应用,"物理应用的话,我认为是从基础学起。",1,1,1,1,0,0
520,理,大学物理1,物理有什么推荐的课本,"物理的话,推荐你看《物理化学导论》",2,2,2,2,2,2
521,理,大学物理1,物理有什么推荐的网课,"物理的话,可以看一下我的专栏。",1,1,1,1,1,1
522,理,大学物理1,质量是什么,"质量就是质量,速度就是速度,速度和速度是什么?",0,0,0,0,0,0
523,理,大学物理1,标量是什么,标量就是速度和速度之间的关系。,2,2,2,2,2,2
524,理,大学物理1,万有引力怎么发现的,"速度是时间的尺度,加速度是空间的尺度。",2,2,2,2,2,2
525,理,大学物理1,埃菲尔铁塔和物理知识有关吗,有关。,2,2,2,2,1,1
526,理,大学物理1,埃菲尔铁塔和物理知识有什么关系,"没有关系,只是一个概念而已。",2,2,2,2,2,2
527,理,大学物理1,生活中的物理知识有哪些,速度和速度有什么关系?,0,0,0,0,0,0
528,理,大学物理1,力学的基本要素,"单摆的力,决定了运动状态的大小。",2,2,2,2,2,2
529,理,大学物理1,牛顿第二定律,这个定律适用于所有物体。,0,0,0,0,0,0
530,理,大学物理1,牛顿第二定律是什么,力学定律。,0,0,0,0,0,0
531,理,大学物理1,牛顿第第三定律,"这么说,你的定律应该是对的。",0,0,0,0,0,0
532,理,大学物理1,牛顿第第三定律是什么,单摆定律的第四定律。,0,0,0,0,0,0
533,理,大学物理1,万有引力定律是什么,万有力学定律。,0,0,0,0,0,0
534,理,大学物理1,刚体和质点有什么关系,"质点是一种现象,由于宏观和微观的不同,所以无法解释。",0,0,0,0,0,0
535,理,大学物理1,法拉第定律是什么,"法拉第效应,你懂的。",0,0,0,0,0,0
536,理,大学物理1,丁达尔效应是什么,丁达尔是广义相对论效应的一种。,2,2,2,2,2,2
537,理,大学物理1,蝴蝶效应和物理有关吗,有关。,2,2,2,2,2,2
538,理,大学物理1,蝴蝶效应和物理有什么关系,这里的蝴蝶效应指的是光的作用力。,0,0,0,0,0,0
539,理,大学物理1,蝴蝶效应和和光学有关吗,有关。,2,2,2,2,2,2
540,理,有机化学,蝴蝶效应和和光学有关吗,有关。,2,2,2,2,2,2
541,理,大学物理1,蝴蝶效应和和光学有关吗,"有关,但不是一回事。",2,2,2,2,2,1
542,理,算法设计与分析,蝴蝶效应和和光学有关吗,"有关,但不完全是。",2,2,2,2,2,1
543,理,有机化学,蝴蝶效应和和光学有关吗,有关。,2,2,2,2,2,2
544,理,有机化学,分子间作用力是什么,分子间的作用力就是分子间相互作用力。,2,2,2,2,2,2
545,理,有机化学,氢键是什么,氢键就是化合价键。,2,2,2,2,2,2
546,理,有机化学,质子和电子怎么排列,质子是电子的一种。,1,1,1,1,0,0
547,理,有机化学,有机化学分析方法有哪些,化合价的一种。,0,0,0,0,0,0
548,理,有机化学,化合价是什么,化合价就是化合价。,0,0,0,0,0,0
549,理,有机化学,石油的元素组成是什么,石油的化合物是什么?,0,0,0,0,0,0
550,理,有机化学,有机化合物中官能团有什么,官能団是属于有机物的一种。,0,0,0,0,0,0
551,理,有机化学,电离是什么,氢氧根、碳氢氧酸、氢氧基,0,0,0,0,0,0
552,理,有机化学,加成反应是什么,"石油的化合物,化学反应。",0,0,0,0,0,0
553,理,有机化学,取代反应是什么,取代反应,0,0,0,0,0,0
554,理,有机化学,有机化学有哪些分析方法,化学分析方法有:1、2、3、4,0,0,0,0,0,0
555,理,有机化学,烷烃是什么,苯乙烯是一种化合物。,0,0,0,0,0,0
556,理,有机化学,烯烃是什么,是一种烯烃的化合物。,2,2,2,2,2,2
557,理,有机化学,炔烃是什么,"可以的话,我也想知道。",1,1,1,2,0,0
558,理,有机化学,醇的化学式,可以的。你在学化学吗?,2,2,2,2,2,1
559,理,有机化学,石油炼制有哪些工艺过程,"碳氢化合物,碳氧化合物",0,0,0,0,0,0
560,理,有机化学,空气中有哪些有机化合物,这个我也不知道。,1,0,2,2,0,0
561,理,有机化学,三苯是什么,苯是一种烯烃的化合物。,2,2,2,2,2,2
562,理,有机化学,三烯是什么,烯烃是一种化学性质的化合物。,2,2,2,2,2,2
563,理,有机化学,有机化合物只要有哪些元素组成,"氢氧化合物,硫磺化合物。",2,2,2,2,2,2
564,理,有机化学,有机化合物有毒吗,"没有毒,只是不适合人体使用。",2,2,2,2,2,2
565,理,有机化学,有机化合物怎么保存比较好,保存的最好是在低温环境下保存。,2,2,2,2,2,2
566,理,有机化学,有机化合物是危险品吗,是的。,2,2,2,2,2,2
567,理,有机化学,怎么制备乙炔,乙炔制备丙炔生成乙炔。,2,2,2,2,2,2
568,理,有机化学,怎么制备笨乙烯,乙炔会生成笨乙烯。,2,2,2,2,2,2
569,理,有机化学,对二甲苯二异氰酸酯是什么,乙炔会生成乙炔。,0,0,0,0,0,0
570,理,有机化学,正戊醇和铝反应生成什么,乙炔会生成化合物。,2,2,2,2,2,2
571,理,有机化学,乙炔是什么,乙炔的熔点。,0,0,0,0,0,0
572,理,有机化学,乙炔是气体吗,是的。,2,2,2,2,2,2
573,理,算法设计与分析,乙炔是气体吗,"是的,乙炔也是气体。",2,2,2,2,2,2
574,理,算法设计与分析,极大值是什么,"极值就是最大值,最小值就是最小值。",1,1,1,1,1,0
575,理,算法设计与分析,极小值是什么,极值就是它的最小值。,1,1,1,1,1,0
576,理,算法设计与分析,拉格朗日极值是什么,就是极值的定义。,2,2,2,2,2,2
577,理,算法设计与分析,拉格朗日极值怎么算,这个我也不知道。,1,0,1,1,0,0
578,理,算法设计与分析,算法要用到编程吗,不需要。,2,2,2,2,2,2
579,理,算法设计与分析,灰度值是什么,"波前计算,每一步都是算法。",2,2,2,2,2,2
580,理,算法设计与分析,有没有波后算法,"没有,简捷的算法只是基于模拟计算的算法。",0,0,0,0,0,0
581,理,算法设计与分析,模拟机算是什么,模拟机算法就是模拟计算,1,0,0,0,0,0
582,理,算法设计与分析,算法怎么学,算法的基础是算法导论。,2,2,2,2,2,2
583,理,算法设计与分析,算法导论怎么学,简捷的算法是什么?,0,0,0,0,0,0
584,理,算法设计与分析,简介的算法是什么,简捷的算法就是一个算法。,1,0,0,0,0,0
585,理,算法设计与分析,欧几里得是哪个国家的,波前数学是什么意思?,0,0,0,0,0,0
586,理,算法设计与分析,波前是什么意思,波前就是波上数列。,2,2,2,2,2,2
587,理,算法设计与分析,波上是什么意思,波上就是波上的意思。,0,0,0,0,0,0
588,理,算法设计与分析,你解释的我听不懂,波前数学模型是什么样的?,0,0,0,0,0,0
589,理,算法设计与分析,数学模型是什么,数学模型就是波前和波前的区别。,0,0,0,0,0,0
590,理,算法设计与分析,数学建模是什么,"数学建模就是把波前的数列,计算出来。",1,1,1,1,1,2
591,理,算法设计与分析,迭代难不难,"欧几多得算法,迭代算法,难不难?",0,0,0,0,0,0
592,理,算法设计与分析,数值分析是什么,欧几多得算法是什么?,0,0,0,0,0,0
593,理,算法设计与分析,欧几里得算法是什么,欧几多得算法就是解决它的方法。,2,2,2,2,2,2
594,理,算法设计与分析,亚里士多德是数学家吗,"欧几多里得数学家,不是数学家。",0,0,0,0,0,0
595,理,算法设计与分析,亚里士多德是哪个国家的,欧几士多得是哪国的?,0,0,0,0,0,0
596,理,算法设计与分析,算法是谁发明的,算法是什么发明的?,0,0,0,0,0,0
597,理,算法设计与分析,算法分析步骤有哪些,"算法分析、算法步骤,包括计算、算法、算法程序。",2,2,2,2,2,2
598,理,算法设计与分析,算法分析工具有哪些,算法的工具包括数据结构、算法逻辑、算法语言。,2,2,2,2,2,2
599,理,算法设计与分析,算法程序是什么,算法程序包括工具、工具、方法、方法。,2,1,2,2,2,2
600,理,算法设计与分析,数据结构是什么,算法结构包括数据结构。,2,2,2,2,2,2
601,理,算法设计与分析,算法逻辑是什么,算法逻辑包括数据、数据、信息、信息。,1,1,2,1,1,1
602,理,算法设计与分析,算法语言是什么,算法语言包括语言。,1,1,1,1,1,1
603,工,软件工程,学习这门课需要编程基础吗？,"不需要,但是要有编程基础。",1,1,1,1,1,1
