,category,course,query,answer,coherence,informativeness,hallucination,humanness,helpfulness,instructiveness
713,其,生活英语读写,如何用语言形容不同规格的建筑,"哦,我知道了,谢谢啊",0,0,0,0,0,0
714,其,生活英语读写,英语写作中最常用的短语是什么,"我才大一啊,我也不知道啊",0,0,0,0,0,0
715,其,生活英语读写,你知道有哪些比较出彩的英语例句吗,你是不是英语专业的啊?,0,0,0,0,0,0
716,其,生活英语读写,是，英语写作和口语表达有什么异同,那你是大几的啊,0,0,0,0,0,0
717,其,生活英语读写,大一大二大三的学生用英语分别怎么表达,"我不太知道,因为我是大一的",1,1,1,1,1,1
718,其,生活英语读写,freshman指的是几年级学生,大一到大三,1,1,1,1,1,1
719,其,生活英语读写,graduator是几年级？,"大一,大二,大三",0,0,0,0,0,0
720,其,日语与日本文化,日语与日本文化是什么课,"我怎么知道,我还没选呢",0,0,0,0,0,0
721,其,日语与日本文化,我学的好累啊，有什么方法轻松学习吗,不学就轻松了,0,0,0,0,0,0
722,其,日语与日本文化,你真是个聊天终结者,因为我是个高冷的人,0,0,0,0,0,0
723,其,日语与日本文化,高冷的人应该懂怎么学日语吧,我又不是日语专业的,1,1,1,1,1,1
724,其,日语与日本文化,那你了解什么日本文化吗,"你想知道哪方面的,我知道的都可以告诉你",1,1,1,1,1,1
725,其,日语与日本文化,哪个方面都行,那我就不知道从哪里开始说了,0,0,0,0,0,0
726,其,日语与日本文化,你知道怎么退课吗,我不知道说什么了,0,0,0,0,0,0
727,其,日语与日本文化,你知道这门课怎么考核吗,写篇论文就好了,2,2,2,1,2,1
728,其,日语与日本文化,你知道这门课怎么在讨论区发言吗,老师会说的吧,1,1,1,1,1,1
729,其,日语与日本文化,日语与日本文化核心概念有哪些,我怎么知道，我没选,0,0,0,0,0,0
730,其,日语与日本文化,你可真是一问三不知,我又不是学日语的,0,0,0,0,0,0
731,其,日语与日本文化,这门课好难啊，有什么办法高效学习,"好好学,不要逃课,我只能帮你到这了",2,2,2,1,2,1
732,其,日语与日本文化,你说的好有道理，我也打算这么做,"嗯,接着说",0,0,0,0,0,0
733,其,日语与日本文化,谢谢你的建议，我觉得很有帮助,"不客气,助人为快乐之本",2,2,2,1,1,1
734,其,日语与日本文化,那你能在回答我一个问题吗,"嗯,说吧,我尽力而为",2,2,2,1,1,1
735,其,日语与日本文化,日语这门课怎么退课,"这个我不懂,你问问其他人吧",2,2,2,1,1,1
736,其,日语与日本文化,那这门课怎么考核,"我不知道啊,我没选过",2,2,2,1,1,1
737,其,日语与日本文化,关于日语，你了解什么,什么都不了解,0,0,0,0,0,0
738,其,日语与日本文化,我得夸夸你，你是个爱国的好机器人,我是中国人哦,0,0,0,0,0,0
739,其,日语与日本文化,是的，中国的机器人,咱们聊点别的吧~,0,0,0,0,0,0
740,其,日语与日本文化,聊什么,聊聊你为什么会被卖片的盯上,0,0,0,0,0,0
741,其,日语与日本文化,你是不是有病,咱们换个话题吧~,0,0,0,0,0,0
742,其,日语与日本文化,我不想跟你聊，换个人,那你想和谁聊,2,2,2,1,1,1
743,其,日语与日本文化,聊不下去,请继续,0,0,0,0,0,0
744,其,日语与日本文化,继续不了,"那就睡吧,我困了,你也早点睡吧",2,2,2,1,1,1
745,其,日语与日本文化,这门课难不难,"不知道,没听过课",0,0,0,0,0,0
746,其,日语与日本文化,怎么退课,"嗯,接着说",0,0,0,0,0,0
747,其,日语与日本文化,我学的好累，效率好低,"不退课了,退不了,我就好好学了",0,0,0,0,0,0
748,其,日语与日本文化,有什么方法高效性学习,"好的,我去试试,谢啦",0,0,0,0,0,0
749,其,日语与日本文化,有什么好方法吗,那你是怎么学的,0,0,0,0,0,0
750,其,日语与日本文化,有什么推荐的课外书,"我买了一本,天才在左,疯子在右",2,2,2,1,2,1
751,其,日语与日本文化,讲什么的,好的我会去看的,0,0,0,0,0,0
752,其,日语与日本文化,好看吗,讲的就是精神病人的世界观,0,0,0,0,0,0
753,其,日语与日本文化,嗯，什么世界观,"我也说不来,你看看就知道了,我还没看完",0,0,0,0,0,0
754,其,日语与日本文化,你跟我大概讲一讲,"我不知道怎么说,你去百度搜一下就有简介",0,0,0,0,0,0
755,其,日语与日本文化,我不想搜，你讲一下,我讲不来,0,0,0,0,0,0
756,其,日语与日本文化,词汇量真匮乏,我没看过怎么跟你讲,2,2,2,1,1,1
757,其,日语与日本文化,有什么好看的电影吗,你要看什么类型的,2,2,2,1,1,1
758,其,日语与日本文化,挪威的森林看过吗,我要看文艺片,0,0,0,0,0,0
759,其,日语与日本文化,什么文艺片,就是那种文艺气息扑面而来的,2,2,2,1,1,1
760,其,现代生活美学——插花之道,现代生活美学——插画之道这门课难不难？,"不难,老师人也很好",2,2,2,1,2,1
761,其,现代生活美学——插花之道,那这门课主要讲的是什么,生活中的插画,2,2,2,1,2,1
762,其,现代生活美学——插花之道,有什么核心的内容吗,"我没上过,我也不知道",2,2,2,1,1,1
763,其,现代生活美学——插花之道,这门课是以实操为主还是以理论基础为主,实操吧,2,2,2,1,2,1
764,其,现代生活美学——插花之道,那岂不是每节课都有机会插花了？,"插花是选修课,你选了就知道了",2,2,2,2,1,1
765,其,现代生活美学——插花之道,这门课课时一共多少？,"一个半小时吧,一节大课",2,2,2,2,1,1
766,其,现代生活美学——插花之道,那怎么考核呢,"不知道,我也没上过",2,2,2,1,1,1
767,其,现代生活美学——插花之道,这门课有机会得到自己的作品吗,"有啊,老师会教你怎么做的,你就可以自己做了",0,0,0,0,0,0
768,其,现代生活美学——插花之道,这门课上完，能不能考个类似的证书,"不能,这是选修课,不是专业课",1,1,1,1,1,1
769,其,现代生活美学——插花之道,这门课挂了需要重修吗？,咱们不聊这些了吧~,0,0,0,0,0,0
770,其,现代生活美学——插花之道,那怎么才能学好这门课,用心学就好了,2,2,2,1,1,1
771,其,现代生活美学——插花之道,没有美术基础也能学习这门课吗,"可以,老师会从零基础开始教",2,2,2,2,2,1
772,其,现代生活美学——插花之道,这门课会对鉴赏能力有提升吧？,会有一定的帮助,2,2,2,2,1,1
773,其,现代生活美学——插花之道,难道就没有什么学习方法吗,我不知道说什么了,0,0,0,0,0,0
774,其,现代生活美学——插花之道,这门课上课需要自己准备耗材吗,耗材?,0,0,0,0,0,0
775,其,现代生活美学——插花之道,插花的原料什么需要准备吗,"不需要,学校有",2,2,2,1,2,1
776,其,现代生活美学——插花之道,这门课感觉有点非传统，很有意思,"是的,很好玩",1,1,1,1,1,1
777,其,现代生活美学——插花之道,可以每学期都选修这门课吗,"不可以,一学年一次",2,2,2,1,2,1
778,其,现代生活美学——插花之道,我马上要学这门课了，你鼓励下我吧,"加油,这是门很好的课",2,2,2,1,2,1
779,其,现代生活美学——插花之道,万一我学成归来，就成插花大师了,"哈哈,有这个可能哦",2,2,2,1,2,1
780,其,现代生活美学——插花之道,什么是生活美学呀,"顾名思义,生活中的美学",2,2,2,2,2,1
781,其,现代生活美学——插花之道,我们为什么需要生活美学,因为我们生活在一个看脸的时代,2,2,2,2,2,1
782,其,现代生活美学——插花之道,插花有什么特点？,"可以让人赏心悦目,陶冶情操",2,2,2,2,2,1
783,其,现代生活美学——插花之道,插花又有什么分类呢？,"插花的种类有很多,你可以百度一下",2,2,2,1,1,1
784,其,现代生活美学——插花之道,插花与花道有什么联系,插花是一种艺术,1,1,1,1,1,1
785,其,现代生活美学——插花之道,中国传统插花追溯于什么朝代,咱们聊点别的吧~,0,0,0,0,0,0
786,其,现代生活美学——插花之道,先秦时期我们就有插花了吗,"那是花道,不是插花",1,1,1,1,1,1
787,其,现代生活美学——插花之道,什么是花道,"你可以去百度,我解释不清楚",0,0,0,0,0,0
788,其,现代生活美学——插花之道,生活四艺包括插花吗？,"我记得是没有的,插花是属于花道的分支",1,1,1,1,1,1
789,其,现代生活美学——插花之道,中国传统插花最兴盛于那个朝代,咱们不聊这些了吧~,0,0,0,0,0,0
790,其,现代生活美学——插花之道,日本花道起源于什么时候,"不知道,你可以百度一下",0,0,0,0,0,0
791,其,现代生活美学——插花之道,日本花道起源于中国吗,咱们换个话题吧,0,0,0,0,0,0
792,其,现代生活美学——插花之道,什么是立华原理？,立华是日本的国花,0,0,0,0,0,0
793,其,现代生活美学——插花之道,日本花道有哪些新型流派？,"我知道的有三种,流花,立华,还有一个叫什么忘了",2,2,2,1,1,1
794,其,现代生活美学——插花之道,中日插花发展有什么不一样吗,"我只知道流花是由花道演变过来的,其他的我就不知道了",2,2,2,1,1,1
795,其,现代生活美学——插花之道,西方插花是从古罗马开始的吗？,"这个你要问其他人了,我不是很了解",1,1,1,1,1,1
796,其,现代生活美学——插花之道,中日及西方插花发展有什么不一样？,"我只关注过中方的,所以无法给你很好的回答",2,2,2,1,1,1
797,其,现代生活美学——插花之道,一般来说，插花需要什么工具,"花道我不太懂,不过我可以帮你问一下",1,1,1,1,1,1
798,其,现代生活美学——插花之道,配色有什么讲究,"嗯,接着说",0,0,0,0,0,0
799,其,现代生活美学——插花之道,插花造型常见有哪几种,"不造,我不懂花道",1,1,1,1,1,1
